,speaker_label,start_time,end_time,text
25,spk_1,41.62683333,42.4435,"Um Theres obviously a pretty significant limitations in terms of what they can do, but theres still learning opportunities that are meaningful right now. Its very challenging because theres limitations being placed based on COVID. So were only allowed to have a certain number of people on site. And I, I would say its also too late frankly, but I think for people that are interested, you know, get in touch with potential mentors in, you know, November, December, February. Do it, do it early act early blanket the universe. Use any connection you possibly have. Its very challenging to find mentors that are willing to host students but dont, dont give up. And every time somebody says no to you say I appreciate you writing back to me. Do you have anybody else who might suggest just keep, keep, keep pummeling away at it? Its very, very unfortunate how, how challenging it is but, you know, just keep, keep at it."
26,spk_0,42.44848333,42.72065,"Excellent, excellent advice. And, um, Lorraine just before we, we let everyone go back to their, their work days because we do know now how busy they are. Um, did you want to share a little bit, um, about the, the Dutchess community connection with the Science Lax program?"
27,spk_4,42.73181667,43.90616667,"Sure. Um Well, you know, and Im also this time around because of the other track, going to mention our human services um psychology track program for associates. So if youre not exactly sure where you wanna go, our liberal arts and science program would be the, the pre med track. But we also do have psychology and if youre really on sure, we have liberal arts and you can experience all of these different classes and take some sciences and, and take some psychology and, and see where you go because as we, as weve heard from our speakers today and speakers in the past, sometimes we, we pivot and we change and I love doctor Alex that you said, dont predetermine your future on very small experiences. We often talk ourselves out of a lot that were capable of. And I really like that. Both of you emphasized uh just working for it, just keep going and keep trying and, and, and putting your effort in and when you do figure it out, you will succeed."
28,spk_0,43.96481667,44.03866667,Ill ask to answer any questions before we let everyone get back to their busy days.
29,spk_1,44.05398333,44.755,"I heard a great, um, I heard a great talk. Im, Im sure its been passed around and Im, and Im like the last person to mention it, but it was a, it was an interview and I forgot with whom. But, you know, the question was asked, you know, whats the best advice that you give young people? Right? And I think the person that was, that responded said, you know, the the standard advice is to find something youre passionate about, right? And I think thats, thats very difficult advice and very kind of misleading because who knows what youre actually passionate about. So the advice is instead find something youre good at that you actually feel that youre good at because if youre good at something youll inevitably succeed in it. And if you succeed in it, everything else comes with that youll get passionate, youll have lots of opportunities, youll be successful financially and all those kinds of things kind of come with"
30,spk_0,44.77398333,45.87448333,"excellent, excellent advice and for today. So I just would like to thank all of our speakers. Um and Id like to thank you for taking the time to put together all that information. And Doctor Alex, thank you for taking the time to spend with us today and share your experiences. And um we will have this recording posted on our website so that if you wanna refer, refer it to any of your, your friends, they can watch it as well. And I will um Im also a resource for you if you ever want to get in touch with either of our speakers today um or make connections for future internships or shadowing. Um To let me know, I wanna thank um Mary Jane and Lorraine and Louise for your help as well. And with that, I um just a reminder that we have one session left in June. I have been emailing you to ask for um any, any specific questions you have. But I think were gonna be focusing on uh wrap up with the educational component on college and career readiness. So be looking for additional emails on that.  But um Doctor
 Watkins, can I just um share just real quick. I wanna make sure that"
31,spk_5,45.88033333,46.61598333,"the um students realize that theres uh everything Angela said is in writing here too. So she gives you what her day is. Um her, her research focus, what shell do with her degree, why she picked the field, um why she take the phd program over anything else? What courses um what the process was? Um how did, how did she get in? I know thats a big question for people. And did she need letters of recommendation? So I just wanna make sure that, you know, because we dont always have quite this much information, but Angela was able to provide us with a lot of information and then heres the people asked about the grades and what scores do you need on standardized test? And do does she pay tuition? So that was all  nicely done by Angela. So I wanted to thank
 her for that."
32,spk_0,46.61948333,47.59831667,"Yes, she did very, very, very well rounded in those responses. So thank you. And that will that one is already posted on the website that he will be there in the next day or two. You can go under students on our website Maya Maya and then underneath students on the left hand side, itll say Career Zoom Series and youll still see every um every link that we had since November. So um and if and if you have any other for future, uh further questions, you can always email me at Amy dot Watkins at W CS dny.org. Well, thank you so much. Uh Thank you again to Angela and Doctor Alex. Youve been amazing and thank you to our students, Rebecca. I think you get the award for being the most loyal participant. So, I it wouldnt be the same without you here. So I really hope you decide to go into a field of health sciences after all of this. So um thank you again. Have a wonderful day. Everyone. Enjoy some vitamin D outside."
