,speaker_label,start_time,end_time,text
9,spk_2,15.86431667,29.34166667,"Sure. Um I am, Im Angela. Im currently 1/4 year graduate student in the psychology department at Rutgers University and specifically, Im in the Behavioral and Systems Neuroscience area. Um So behavioral Neuroscience just means that I am very interested in what the brain is doing. But Im also interested in interpreting behavior to see whats happening in the brain and interpreting whats happening in the brain to see why the behavior is happening. Um I graduated from Ketchum in 2013. So its been a while now. Um And I was one of those students who was just good at everything, which really sounds like a humble brag. Um And its, its not a bad thing, but when it came time to say, what do I want to do? What I want to be? When I grew up in college, I had no idea. I had no idea what I wanted to do. People would be like, well, what are you good at in school? And the answer is, well, theres nothing that really stands out. Everything is, Im just sort of, I could do it all really. So I ended up, I didnt end up, I chose Binghamton University um for a couple of reasons. Its a really great university, a great education. Its a suny. So you save your money a little bit that way. Um And its also a pretty big university. So Im at Rutgers right now which has like 50,000 undergrads, which is huge. Binghamton had like 16,000. So it was big but not like out of this world. Huge. Um And I wanted a bigger university. So that, because I was undecided if I wanted to be a journalist one day next semester, I wanted to be a pharmacist. I didnt have to leave my college. I didnt have to transfer universities. I could really stay where I was. Um, and so I knew what I didnt like. I didnt like math. I wasnt really a huge fan of history and I knew Im, Im very much a people person. I like being with people and working with people, but I didnt want to work with people in any kind of medical or clinical capacity. Um I just felt like it could be kind of draining. I know it can be very rewarding to work with people. But I just felt like for me that wasnt gonna be what I wanted. Um But I did like science and everything. So I went in and I was like, maybe psychology because I really like criminal minds. I watched that a lot in high school and I actually applied to forensic psychology programs. I really considered it. So thats why I was kind of thinking psychology. My first semester I took an intro psych course and I didnt love it because a lot of psychology, well, theres like cognition, theres social psychology, theres developmental psychology and those werent really areas that interests me. And then we started talking about like neuroscience and behavioral neuroscience. Um And like what the brain is doing on like a chemical, molecular sort of matter. And thats what I really liked. And I found out through a friend that Binghamton had an integrated neuroscience program and I was like, that sounds really interesting. And so if I had never run into that friend, I dont know if I would have ever ended up doing neuroscience, but everything sort of fell in place with me. And by the end of my freshman year I had declared as an integrative neuroscience major. My sophomore year, I took a drugs and behavior course and I really, really liked that. Um I thought it was really interesting how you can add something to a system and see it change. So youre adding any kind of drug to the body, it affects the central nervous system, it affects your behavior, things like that. And that was my sophomore year. And around that time, I had a lot of friends who were, um, they were joining research labs and I was like, maybe I should be doing that too. So I joined a research lab as an undergraduate research assistant working in an alcohol lab. We were working with road models of chronic alcohol exposure to see the, to study the neurobiology of learning and memory. And I was actually really nervous to work with animals at first because I love animals so much. My cats my best friend and I know animal research is really important, but I wasnt sure I would feel doing it um, but the animals are held to the highest standards. They are treated so well. They get vet visits every day. They, theres really, its hard, but it makes sense and it, it was ok for me. So that was like my first experience working with animals. Um, and I really liked it. I really like that. I could do something experimental to an animal. Follow it through. I can see its behavior. Unfortunately, you do have to kill the animal to collect its brain. But then I can look at the brain cells and see the impact of the behavioral paradigm, the animal went through or that alcohol treatment that the animal had. And so I really like that and it wasnt until the end of my junior year of college that I was like, maybe I should go to grad school because I started thinking, ok, I have one more year of college left. What am I gonna do with a Bachelors degree in integrative Neuroscience. Um, and one of the reasons I didnt want to do psychology because in my head as a freshman, I was like, if you get a psych degree, youre a counselor or a therapist or something. And I didnt want to go to all that school. I didnt want to be in school till I was 30. Um, as it turns out, Ill be in school until Im 27. Um, but I really like this path, my undergrad research experience really I feel like it kind of like fell in my lap happened, but thats what set me on the path that Im on now. And so I, like I said, I majored in integrative neuroscience, which was essentially an entire psychology degree as well as chemistry. Um, I had to take physics, which was horrible. Physics is really hard. Like I said, I dont like math. Um, some upper level level bio courses and some math courses with nothing too advanced. Um, a lot of people actually used that degree at Binghamton for like a pre health track. So I took a lot of like classes that a lot of like med students would have taken. But I tailored it more to be more on like the psychology side. And so the psychology classes came easy to me, it was something I was very interested in. Um, so I did get a good amount of As in college, but I also got some Bs and Cs in some of my harder classes. I ended up graduating with a 34, which its not bad but, you know, like its not excellent. I didnt get to graduate with honors or anything. Um And I say that because for grad school, I had like this preconceived notion that like the best of the best students go on to grad school to go on and get these, like, you know, their MD, their phd. Um And so I really sort of doubted myself as an applicant because I was comparing myself to other people and things like that. But I had good, I had really good grades in my psychology classes. And then I had mostly these, these pluses in my others. And I was applying to psychology programs for grad school. Um, grad school, theres so much involved in grad school and depending on what you want to do or where you want to go. Um, I really like neuroscience, but like I said, I like behavioral neuroscience, which is typically held in psychology departments. So I focused my grad school search for psychology departments with areas of research that interested me because in psychology departments, you get accepted to a faculty members lab and if you dont match up with a faculty member, you dont really get accepted to the program. Theres other programs that sort of rotate, theres a lot that goes into it, but I knew exactly what I wanted to research or I thought I did, I really, really like drugs. I think drugs are really cool, studying them. Um So I wanted to do drugs and I wanted to do addiction research. Um and thats how I ended up at Rutgers. Um And theres a lot more information on the powerpoint about how I ended up there. So you can always check and read that. Um But the phd program is typically a five year program and whats really great about getting a phd in psychology or biology, neuroscience, chemistry, things like that is that you get paid to be a graduate student. So I signed up for five more years of college, but I also signed a contract. So Im getting paid for these five years and Im not paying my tuition, I never see a bill for my tuition. So Im getting a phd for free and theyre paying me and theyre paying me because Im doing really important work for the university. Im doing really important research and I also teach classes as part of that stipend that I earn. So I teach classes in the undergraduate psychology department at Rutgers, which is really great experience because I was 22 when I graduated college. So I was teaching other 22 year olds at 22. Im 25 now. So Im like teaching my peers basically. Um And teaching is something that Im comfortable in. Its an experience that I think Im good at, but its not necessarily what I really want. I really like being in the lab. I really like my research. I think its very rewarding. Im seeing my education pay off every day. Um And grad school is really great because obviously I like learning if I was gonna sign up for five more years of school and in high school, they want you to be a really well rounded student in college, you have to take gen EDS. So youre a well rounded student. But grad school is where you pick what you want to study, what youre interested in. And so, like I said, Im really interested in drugs and behavior. Um, if you were interested in another facet of psychology or neuroscience or any other topic, you study what you want to study. And so Im currently researching the effects of chronic opioid abuse on how your immune system functions and how your immune system communicates with your brain. And I think its really super cool. Um But theres so many other things you can do. I know, not everyone loves playing with brains, but I get to go and I get to slice brains and I stain brains and I look at the cells and I see the impact of the treatment that I did on them. Um And I really love my research. So I think if, if you can take any sort of opportunity, if you kind of like science and things like that, any opportunity to get you, I dont know any kind of experience in college or anything like that, that would be my advice. But also other advice, even if you dont wanna go on like necessarily a research route, but you want to do like the health care sort of field um would be to not underestimate yourself as a student or an applicant. I compared myself to everyone. I compared my grades, I compared my experiences, you know, my extracurricular activities because I felt like I wasnt a perfect applicant and honestly, that did hold me back from applying to maybe programs or schools that I wanted to. Um because I just couldnt get myself to do it and I missed the deadline. Um, but looking back, I had my own unique experience and everyone has a unique experience and it was, its like comparing apples and oranges. Um, so dont let your grades get you down. Like I had a couple Cs um Doctor Coulson had ad, you know, um you can bounce back from it and its not sort of like the end of the world. Um So I guess that was my trajectory a day in my life. It really kind of depends as a grad student. My first two years, I was taking classes while working in the lab. Now I am done taking classes. I never have to take class again, which is wonderful. Um And it really kind of depends on where my experiment is because I am in charge of project management. I do personnel management. I do finance management. I really run my lab and Im in charge of making sure everything gets done. So right now, I am currently staining brain tissue. I had rats um self administer fentaNYL, a really, really strong opioid, they self administered fentaNYL. And then I am looking at certain immune cells in the brain to see how they responded to that treatment. So I spend my days staining cells, Ill be imaging cells. Ill be counting cells. Im also working on publishing some of my data, so Ill be a published author soon. So Im writing up papers. Um I enjoy writing. So writing, I mean, its a very tedious task, but I like it in the end. Writing is something Im good at, so I enjoy doing that. Um So my, my day to day it, its very casual, its very casual in the lab. Um And in terms of a work life balance with grad school, unfortunately, its kind of expected that you spend all your time in the lab, you spend a lot of time doing your schoolwork, doing your research. Thats not to say that you cant accomplish a healthy work life balance. Thats something that I really pride myself on. I just like, feel deep in my bones that I will not like give my life up for my work for my education or anything. I think there has to be a place for a healthy work life balance. So I fully feel like I do achieve it. I do have really early mornings and really late nights sometimes. Um, but I make sure that I have most of my weekends, I make sure that after dinner I have my free time because its not like Im studying for exams anymore. I feel this really feels like a job like I am a neuroscientist. And so I want to treat it like a job because Ive been in school since I was five. Im 25 now. So its been 20 years and Im getting a little tired of feeling like a student. So Im trying to do things that make me feel like an adult because I am an adult even though Im still a student. Um, so its sort of like a weird transition. Um But yeah, I hope that answered the task there."
10,spk_0,29.35016667,29.925,"You definitely did a great job and there is tons of information on the slide so students can go back to that. So, do you want to open it up to our students? Um to see if anyone would like to turn their camera on to ask a question or um if youd like to come off uh mute or put something in the chat, um Ill give everyone a second or two. OK. OK. Good. So, um Rebecca is asking what exactly is the difference between psychology and psychiatry? So, Doctor Alex, do you want to take that one?"
11,spk_1,29.944,31.19315,"Um So in practice, theres significant differences, although theres also a lot of overlap in terms of the training, theres there, theres a dramatic difference. Um So clinical psychology um tends to require graduate school in psychology. Whereas psychiatry requires medical school in practice, clinical psychologists, if theyre working with patients, for example, will do therapy and psychiatrists can do therapy, but theyre also able to prescribe medication. So I would say psychiatry is probably more biologically based, more focused on disease and biologically based or medication based treatments. Um And the training pathway is very different. Um But yet they both deal very clearly with the same organ which is the brain of the mind. And um and theres a lot of overlap in terms of the patients that we see, theres a lot of collaboration between the, between the two fields. So I I work closely with lots of psychologists, people, people tend to boil it down to something very basic, which is that psychiatrists prescribe medicine, psychologists do therapy. Right."
12,spk_0,31.2085,31.51998333,"Um Definitely the training is, is, is different. Um because you have to understand the medical implications, other questions and give everyone a chance to think through um  questions. Maya, you wanna ask a question, you
 can come off."
13,spk_3,31.52783333,32.23448333,"Um I dont necessarily have a question. Um This is my first time joining you guys as zoom because every time I always end up being at work so early and I never get a chance to join. And I just wanna say that I appreciate the transparency because right now I think because of, you know, everything thats going on last year and this year that I havent done the best academically and I would like to go to med school and because of my grades, its made me like really nervous about what I wanna do in the future and you know, hearing other people that get bad grades and they compare themselves to others and you know, stuff like that. It just makes you feel like, ok, this is, this is a normal feeling and, you know, Ill get through it and its not the end of the world. So I really do appreciate you guys telling your stories and you know, your tasks in everyday life and stuff like that."
14,spk_0,32.24981667,32.30666667,"Well, thank you, maya. Yeah, de de determination. Go ahead, doctor."
15,spk_1,32.33133333,33.74098333,"No, I mean, I, I Yeah, II, I appreciate the comment. I dont know. What, what year are you right now? Im a junior in high school. Yes. Yeah. So its not too late. Believe me. I think the, you know, the barrier to entry for medical school is very, very high. So I, I dont mean to sugar coat it. Obviously grades need to be very, very high. Um, at some point. But what, where your grades are now, I can say with confidence are entirely irrelevant to whether you can make it to medical school or not. I, I mean, II I appreciated Angelas point about not wanting school to take over your life. I would say with medicine, it does at least for a brief period of time, take over your life. It is everything because you wanna kind of get yourself into the school. Um, the hardest time in my life was the year that I was applying to medical school for sure. Or I didnt know what I get in when I knock it in. I was so preoccupied with my grades and looking back and all the regrets and I should have gotten this A plus instead of a B or an A minus. And I thought everything hinged. Then theres a great joke that, um, once you get into medical school, do you know what they call the person that graduates last in their class doctor? So once you get in, you just have to pass your glasses and get through it.  Excellent
 advice,"
16,spk_0,33.76533333,34.25433333,"other questions. Um Ill open up to our panel too as I uh kind of go through some of our previous questions. Um If anyone wants to come off, I can ask a question. I did, I would like to ask um Doctor Alex about the research youre doing as psychiatrist.  Can. Can you share
 a little? Yeah, of course."
17,spk_1,34.2545,36.0545,"So when I started practicing as a psychiatrist, I found myself frustrated at our inability to really predict who might respond to certain kinds of treatments, right? We have lots of treatments for anxiety and depression and various other symptoms, but we dont do a very good job of being able to predict who might respond to a certain treatment over another treatment. And so I got interested in the idea of predicting treatment response and, and using things like genetics or biomarkers, you know, kind of biological markers in the blood or using um techniques that measure electrical activity in the brain, like using EEG and I thought, wow, you know, its wonderful to be able to treat patients and affect families on kind of a case by case basis. But when you do research, you can theoretically kind of move the whole field forward and you can, you can kind of, you know, drive major change. And so I got interested in clinical trials where we use things like genetics and we select populations of patients based on underlying genetic changes, whether its a specific genetic mutation in the gene that causes autism. Um And we try to understand the changes in the brain on the basis of what we know about the genetic changes. And then we think about ways to compensate for those changes in the brain using specific medicines. And then we study them in the context of a clinical trial. We will, we will take patients with a specific genetic mutation and we will enroll them either in a placebo group or a medication group and then we will follow them over time and we will look at improvement in, in, in clinical outcomes. Um And the, the goal is to develop new treatments. Mostly my, my research is mostly focused on autism. So the goal is to develop new treatments in autism,"
18,spk_0,36.08665,36.62183333,"I am one of the directors in Wappingers Central School District. between the work that Angela does even though um maybe the study on o opioids isnt the same but that it has to come from the animal point to come to you because your trials are on humans where her trials, you, you take the studies that develop through the research that comes from those animal trials. Um I dont know if either one of you wanna expand on that, how they feed into one another,  the importance of
 both."
19,spk_2,36.62916667,39.18715,"Um Yeah, of course. Um Ultimately, I feel like everything that we do in research is to improve some kind of human experience. Um And so I study drug addiction and although Im interested in sort of like neuro immunomodulation, um Im well versed in a lot of different aspects of it. Um And so I do read human clinical trials sort of to see, get more background, get more information, but just, um I mean, Im not the most well versed in clinical trials, but I do know that a lot of things, a lot of drug trials, it has to start in an animal model first because you cant just recruit people off the street and said, hey, I have this new pill, Id love to see how it works. Would you like to try it? Um Its, thats very unethical. So the ethical route is to start in an animal model. And so if I can see, for instance, um my research is based on the fact that um a lot of chronic opioid users, whether its addiction or if its like a chronic opioid treatment with your doctor or something for chronic pain, there is some kind of degree of suppression of immune system activity. So that means that you are more susceptible to infection or illness than a healthy individual. And so, with my animal model, Im looking to see what is the degree of this suppression for chronic opioid abuse. And does this recover after a certain period of abstinence? And this, of course, Im sure you can imagine has a ton of implications, but if I can identify what exactly is being suppressed, how it is being suppressed. Um and maybe speculate on what this could mean, this could be used potentially in um rehabilitation facilities or sort of trials that are looking to help um drug addicts recover. Um Maybe one day very, very far in the future, we can cure addiction and it will take a lot of, you know, collaboration from a lot of different groups. But so my research, although it is in animals, the findings could have very significant implications for human trials. And so were not completely, Im not completely removed from human trials, although I probably wont ever my my specific research, I would not bring that to human clinical trials because thats like very, very far away. But I would pass it on to someone like Doctor Alex if he was researching something that I was, and its something that we could collaborate about and I can tell him hinge findings and then someone who is more well versed with humans can see how do we adapt that to a human trial?"
20,spk_0,39.23631667,39.89848333,"Mhm. Are there any other questions or anything that anyone would like to add? Very quiet today and try Doctor Alex? Are there any skills that, um, you could share with our students that you feel um, would be beneficial for them? So soft, the soft skills that, um, you can learn in a textbook or in a college classroom? But if its something that they could work on and then also, I always want to ask if theres internship opportunities or shadowing opportunities for our students, if they wanted to learn more about this field."
21,spk_1,39.91266667,41.27715,"Sure. I think um I mean, as a physician, somebody who works with people, I think probably the most important skill is a communication skill, the ability to express things in language that can be easily understood. I think that skill also translates to being a good teacher. So if you can take complicated ideas and explain them to people, so they understand thats extremely valuable. Um So communication skills and then kind of equally important is, is communication skills through writing. And I know we all spend a lot of time doing emails. Um But I think that youre writing, whether its, you know, papers that Angela is working on or even just a simple email, thats a reflection of you. Its a reflection of how you think. And I think its worth being very, very thoughtful about how you want to express yourself um with language and writing. Um and I, I definitely found that the ability of someone to kind of progress in their career after theyve all kind of met a certain level of um competency in, you know, educational skills or, you know, learning has a lot to do with how well they communicate with others. Um Yeah. Yeah. The second part of the question that I forgot already."
22,spk_0,41.29515,41.38333333," Thats OK. Um Internships.
 Uh Yes. Yeah. Yeah, of course, of course. Yeah. So"
23,spk_1,41.38883333,41.52933333,"post COVID, talk to me. So, yeah, I think um we always host students for shadowing for, for research internships. Um"
24,spk_0,41.53248333,41.61416667,"Even high school, they dont have to be in college.  Yeah,
 they dont have to be in college. They had to be over 16."
