,speaker_label,start_time,end_time,text
0,spk_0,0.00015,0.022500000000000003,"Yeah, the universal one."
1,spk_1,0.037649999999999996,0.08115,So presumably that might be an idea too.
2,spk_2,0.08848333333333333,0.16848333333333335,"But, but 25 you need a lot of neat features."
3,spk_1,0.17316666666666666,0.3406666666666667,"Yeah. Yeah. Uh cause I mean, what €25 thats about, I dont know, £15 or so and thats quite a lot for remote control."
4,spk_0,0.36833333333333335,0.8081666666666667,"Um Well, my first thought would be most remote controls. A re grey or black, as you said, they come with a TV. So its normally just your basic grey and black remote controls as functions. So maybe we could think about colour make that might make it a bit different from the rest a t least. Um And as you say, we need to have some kind of gimmick. So um I thought maybe something like."
